<?xml version="1.0" encoding="UTF-8"?>
<table xmlns="http://www.sa.dk/xmlns/siard/1.0/schema0/table.xsd"
       xmlns:xsi="http://www.w3.org/2001/XMLSchema-instance"
       xsi:schemaLocation="http://www.sa.dk/xmlns/siard/1.0/schema0/table.xsd table.xsd">
    <row>
        <c1>1</c1>
        <c2>2</c2>
        <c3>1991-09-23T12:00:00.510000</c3>
        <c4 xsi:nil="true"/>
        <c5 xsi:nil="true"/>
        <c6 xsi:nil="true"/>
        <c7 xsi:nil="true"/>
        <c8>3</c8>
        <c9>A</c9>
        <c10>B</c10>
        <c11>C</c11>
        <c12>D</c12>
    </row>
    <row>
        <c1>4</c1>
        <c2>5</c2>
        <c3>1992-10-24T13:00:00.520000</c3>
        <c4 xsi:nil="true"/>
        <c5 xsi:nil="true"/>
        <c6 xsi:nil="true"/>
        <c7 xsi:nil="true"/>
        <c8>6</c8>
        <c9>E</c9>
        <c10>F</c10>
        <c11>G</c11>
        <c12>H</c12>
    </row>
    <row>
        <c1>7</c1>
        <c2>8</c2>
        <c3>1993-11-25T14:00:00.530000</c3>
        <c4 xsi:nil="true"/>
        <c5 xsi:nil="true"/>
        <c6 xsi:nil="true"/>
        <c7 xsi:nil="true"/>
        <c8>9</c8>
        <c9>I</c9>
        <c10>J</c10>
        <c11>K</c11>
        <c12>L</c12>
    </row>
</table>